{
  "$schema": "../security-control.schema.json",
  "ControlID": "ISO27001-2022_A.5.6",
  "Category": "Organizational Controls",
  "Name": "Contact with special interest groups",
  "Description": "The organization shall establish and maintain contact with special interest groups or other specialist security forums and professional associations.",
  "Publisher": "ISO/IEC",
  "Framework": "ISO 27001:2022",
  "AdditionalInfo": {
    "Edition": "3",
    "PublishDate": "2022-10"
  }
}
