{
  "$schema": "../security-control.schema.json",
  "ControlID": "ISO27001-2022_A.8.5",
  "Category": "Technological Controls",
  "Name": "Secure authentication",
  "Description": "Secure authentication technologies and procedures shall be implemented based on information access restrictions and the topic-specific policy on access control.",
  "Publisher": "ISO/IEC",
  "Framework": "ISO 27001:2022",
  "AdditionalInfo": {
    "Edition": "3",
    "PublishDate": "2022-10"
  }
}
