{
  "$schema": "../security-control.schema.json",
  "ControlID": "ISO27001-2022_A.6.5",
  "Category": "People Controls",
  "Name": "Responsibilities after termination or change of employment",
  "Description": "Information security responsibilities and duties that remain valid after termination or change of employment shall be defined, enforced and communicated to relevant personnel and other interested parties.",
  "Publisher": "ISO/IEC",
  "Framework": "ISO 27001:2022",
  "AdditionalInfo": {
    "Edition": "3",
    "PublishDate": "2022-10"
  }
}
