{
  "$schema": "../security-control.schema.json",
  "ControlID": "ISO27001-2022_A.7.5",
  "Category": "Physical Controls",
  "Name": "Protecting against physical and environmental threats",
  "Description": "Protection against physical and environmental threats, such as natural disasters and other intentional or unintentional physical threats to infrastructure shall be designed and implemented.",
  "Publisher": "ISO/IEC",
  "Framework": "ISO 27001:2022",
  "AdditionalInfo": {
    "Edition": "3",
    "PublishDate": "2022-10"
  }
}
