{
  "$schema": "../security-control.schema.json",
  "ControlID": "CB-AZ-019",
  "Category": "Data Protection",
  "Name": "Data Masking",
  "Description": "Apply dynamic data masking on sensitive fields in databases.",
  "Publisher": "Contoso Bank",
  "Framework": "Contoso Bank Azure Security Control Framework",
  "AdditionalInfo": {
    "Action": "Protect PII in non-production environments.",
    "LastUpdatedDate": "September 2025",
    "Link": "https://contosowebsite.azurewebsites.net/",
    "Version": "1.0.0",
    "Note": "This dummy control is generated by ChatGPT. It is designed for demonstration purposes only."
  }
}
