{
  "$schema": "../security-control.schema.json",
  "ControlID": "CB-AZ-035",
  "Category": "Compliance & Governance",
  "Name": "Regulatory Compliance",
  "Description": "Continuously assess Azure resources against compliance standards.",
  "Publisher": "Contoso Bank",
  "Framework": "Contoso Bank Azure Security Control Framework",
  "AdditionalInfo": {
    "Action": "Use Microsoft Defender for Cloud regulatory dashboard.",
    "LastUpdatedDate": "September 2025",
    "Link": "https://contosowebsite.azurewebsites.net/",
    "Version": "1.0.0",
    "Note": "This dummy control is generated by ChatGPT. It is designed for demonstration purposes only."
  }
}
