{
  "$schema": "../security-control.schema.json",
  "ControlID": "CB-AZ-029",
  "Category": "Resilience & Backup",
  "Name": "Disaster Recovery",
  "Description": "Critical workloads must have an Azure Site Recovery plan.",
  "Publisher": "Contoso Bank",
  "Framework": "Contoso Bank Azure Security Control Framework",
  "AdditionalInfo": {
    "Action": "Test failover annually.",
    "LastUpdatedDate": "September 2025",
    "Link": "https://contosowebsite.azurewebsites.net/",
    "Version": "1.0.0",
    "Note": "This dummy control is generated by ChatGPT. It is designed for demonstration purposes only."
  }
}
