{
  "$schema": "../security-control.schema.json",
  "ControlID": "ISO27001-2022_A.8.21",
  "Category": "Technological Controls",
  "Name": "Security of network services",
  "Description": "Security mechanisms, service levels and service requirements of network services shall be identified, implemented and monitored.",
  "Publisher": "ISO/IEC",
  "Framework": "ISO 27001:2022",
  "AdditionalInfo": {
    "Edition": "3",
    "PublishDate": "2022-10"
  }
}
