{
  "$schema": "../security-control.schema.json",
  "ControlID": "ISO27001-2022_A.8.33",
  "Category": "Technological Controls",
  "Name": "Test information",
  "Description": "Test information shall be appropriately selected, protected and managed.",
  "Publisher": "ISO/IEC",
  "Framework": "ISO 27001:2022",
  "AdditionalInfo": {
    "Edition": "3",
    "PublishDate": "2022-10"
  }
}
