{
  "$schema": "../security-control.schema.json",
  "ControlID": "CB-AZ-022",
  "Category": "Monitoring & Logging",
  "Name": "Audit Privileged Access",
  "Description": "Log and monitor all privileged access activities.",
  "Publisher": "Contoso Bank",
  "Framework": "Contoso Bank Azure Security Control Framework",
  "AdditionalInfo": {
    "Action": "Retain logs for minimum 7 years for compliance.",
    "LastUpdatedDate": "September 2025",
    "Link": "https://contosowebsite.azurewebsites.net/",
    "Version": "1.0.0",
    "Note": "This dummy control is generated by ChatGPT. It is designed for demonstration purposes only."
  }
}
