{
  "$schema": "../security-control.schema.json",
  "ControlID": "ISO27001-2022_A.8.13",
  "Category": "Technological Controls",
  "Name": "Information backup",
  "Description": "Backup copies of information, software and systems shall be maintained and regularly tested in accordance with the agreed topic-specific policy on backup.",
  "Publisher": "ISO/IEC",
  "Framework": "ISO 27001:2022",
  "AdditionalInfo": {
    "Edition": "3",
    "PublishDate": "2022-10"
  }
}
