{
  "$schema": "../security-control.schema.json",
  "ControlID": "ISO27001-2022_A.8.23",
  "Category": "Technological Controls",
  "Name": "Web filtering",
  "Description": "Access to external websites shall be managed to reduce exposure to malicious content.",
  "Publisher": "ISO/IEC",
  "Framework": "ISO 27001:2022",
  "AdditionalInfo": {
    "Edition": "3",
    "PublishDate": "2022-10"
  }
}
