{
  "$schema": "../security-control.schema.json",
  "ControlID": "CB-AZ-040",
  "Category": "Security Operations",
  "Name": "Incident Response Plan",
  "Description": "Maintain and test an Azure-specific incident response plan.",
  "Publisher": "Contoso Bank",
  "Framework": "Contoso Bank Azure Security Control Framework",
  "AdditionalInfo": {
    "Action": "Run tabletop exercises at least annually.",
    "LastUpdatedDate": "September 2025",
    "Link": "https://contosowebsite.azurewebsites.net/",
    "Version": "1.0.0",
    "Note": "This dummy control is generated by ChatGPT. It is designed for demonstration purposes only."
  }
}
