{
  "$schema": "../security-control.schema.json",
  "ControlID": "CB-AZ-008",
  "Category": "Networking",
  "Name": "Virtual Network Segmentation",
  "Description": "Separate production, development, and test workloads into isolated VNets.",
  "Publisher": "Contoso Bank",
  "Framework": "Contoso Bank Azure Security Control Framework",
  "AdditionalInfo": {
    "Action": "Apply NSGs and route tables to control inter-VNet traffic.",
    "LastUpdatedDate": "September 2025",
    "Link": "https://contosowebsite.azurewebsites.net/",
    "Version": "1.0.0",
    "Note": "This dummy control is generated by ChatGPT. It is designed for demonstration purposes only."
  }
}
