{
  "$schema": "../security-control.schema.json",
  "ControlID": "ISO27001-2022_A.7.8",
  "Category": "Physical Controls",
  "Name": "Equipment siting and protection",
  "Description": "Equipment shall be sited securely and protected.",
  "Publisher": "ISO/IEC",
  "Framework": "ISO 27001:2022",
  "AdditionalInfo": {
    "Edition": "3",
    "PublishDate": "2022-10"
  }
}
