{
  "$schema": "../security-control.schema.json",
  "ControlID": "ISO27001-2022_A.5.31",
  "Category": "Organizational Controls",
  "Name": "Legal, statutory, regulatory and contractual requirements",
  "Description": "Legal, statutory, regulatory and contractual requirements relevant to information security and the organization's approach to meet these requirements shall be identified, documented and kept up to date.",
  "Publisher": "ISO/IEC",
  "Framework": "ISO 27001:2022",
  "AdditionalInfo": {
    "Edition": "3",
    "PublishDate": "2022-10"
  }
}
