{
  "$schema": "../security-control.schema.json",
  "ControlID": "ISO27001-2022_A.5.36",
  "Category": "Organizational Controls",
  "Name": "Compliance with policies, rules and standards for information security",
  "Description": "Compliance with the organization's information security policy, topic-specific policies, rules and standards shall be regularly reviewed.",
  "Publisher": "ISO/IEC",
  "Framework": "ISO 27001:2022",
  "AdditionalInfo": {
    "Edition": "3",
    "PublishDate": "2022-10"
  }
}
