{
  "$schema": "../security-control.schema.json",
  "ControlID": "ISO27001-2022_A.8.31",
  "Category": "Technological Controls",
  "Name": "Separation of development, test and production environments",
  "Description": "Development, testing and production environments shall be separated and secured.",
  "Publisher": "ISO/IEC",
  "Framework": "ISO 27001:2022",
  "AdditionalInfo": {
    "Edition": "3",
    "PublishDate": "2022-10"
  }
}
