{
  "$schema": "../security-control.schema.json",
  "ControlID": "CB-AZ-048",
  "Category": "Endpoint Security",
  "Name": "Device Compliance",
  "Description": "Enforce device compliance before accessing Azure resources.",
  "Publisher": "Contoso Bank",
  "Framework": "Contoso Bank Azure Security Control Framework",
  "AdditionalInfo": {
    "Action": "Integrate Intune with Conditional Access policies.",
    "LastUpdatedDate": "September 2025",
    "Link": "https://contosowebsite.azurewebsites.net/",
    "Version": "1.0.0",
    "Note": "This dummy control is generated by ChatGPT. It is designed for demonstration purposes only."
  }
}
