{
  "$schema": "../security-control.schema.json",
  "ControlID": "ISO27001-2022_A.7.7",
  "Category": "Physical Controls",
  "Name": "Clear desk and clear screen",
  "Description": "Clear desk rules for papers and removable storage media and clear screen rules for information processing facilities shall be defined and appropriately enforced.",
  "Publisher": "ISO/IEC",
  "Framework": "ISO 27001:2022",
  "AdditionalInfo": {
    "Edition": "3",
    "PublishDate": "2022-10"
  }
}
