{
  "$schema": "../security-control.schema.json",
  "ControlID": "ISO27001-2022_A.5.24",
  "Category": "Organizational Controls",
  "Name": "Information security incident management planning and preparation",
  "Description": "The organization shall plan and prepare for managing information security incidents by defining, establishing and communicating information security incident management processes, roles and responsibilities.",
  "Publisher": "ISO/IEC",
  "Framework": "ISO 27001:2022",
  "AdditionalInfo": {
    "Edition": "3",
    "PublishDate": "2022-10"
  }
}
